Provider ID,Hospital Name,Address,City,State,ZIP Code,County Name,Phone Number
10005,MARSHALL MEDICAL CENTER SOUTH,2505 U S HIGHWAY 431 NORTH,BOAZ,AL,35957,MARSHALL,2565938310
10012,DEKALB REGIONAL MEDICAL CENTER,200 MED CENTER DRIVE,FORT PAYNE,AL,35968,DE KALB,2568453150
10131,CRESTWOOD MEDICAL CENTER,ONE HOSPITAL DR SE,HUNTSVILLE,AL,35801,MADISON,2568823100
20001,PROVIDENCE ALASKA MEDICAL CENTER,BOX 196604,ANCHORAGE,AK,99508,ANCHORAGE,9072123675
20018,YUKON KUSKOKWIM DELTA REG HOSPITAL,PO BOX 287,BETHEL,AK,99559,BETHEL,9075436300
30071,FORT DEFIANCE INDIAN HOSPITAL,PO BOX 649,FORT DEFIANCE,AZ,86504,APACHE,9287298000
30073,TUBA CITY REGIONAL HEALTH CARE CORPORATION,PO BOX 600,TUBA CITY,AZ,86045,COCONINO,9282832501
30084,CHINLE COMPREHENSIVE HEALTH CARE FACILITY,"US HWY 191, HOSPITAL ROAD",CHINLE,AZ,86503,APACHE,9286747001
40007,CHI-ST VINCENT INFIRMARY,TWO ST VINCENT CIRCLE,LITTLE ROCK,AR,72205,PULASKI,5015523000
40018,SPARKS MEDICAL CENTER - VAN BUREN,EAST MAIN AND SOUTH 20TH STREET,VAN BUREN,AR,72956,CRAWFORD,4794743401
40050,OUACHITA COUNTY MEDICAL CENTER,638 CALIFORNIA AVENUE,CAMDEN,AR,71701,OUACHITA,8708361000
50054,SAN GORGONIO MEMORIAL HOSPITAL,600 NORTH HIGHLAND SPRINGS AVENUE,BANNING,CA,92220,RIVERSIDE,9518451121
50055,CALIFORNIA PACIFIC MEDICAL CTR - ST. LUKE'S CAMPUS,3555 CESAR CHAVEZ STREET,SAN FRANCISCO,CA,94110,SAN FRANCISCO,4156416562
50103,WHITE MEMORIAL MEDICAL CENTER,1720 E CESAR AVENUE,LOS ANGELES,CA,90033,LOS ANGELES,3232685000
50224,HOAG MEMORIAL HOSPITAL PRESBYTERIAN,ONE HOAG DRIVE,NEWPORT BEACH,CA,92663,ORANGE,9497644624
50280,MERCY MEDICAL CENTER REDDING,"2175 ROSALINE AVE, CLAIRMONT HGTS",REDDING,CA,96001,SHASTA,5302256102
50309,SUTTER ROSEVILLE MEDICAL CENTER,ONE MEDICAL PLAZA,ROSEVILLE,CA,95661,PLACER,9167811000
50359,TULARE REGIONAL MEDICAL CENTER,869 CHERRY AVENUE,TULARE,CA,93274,TULARE,5596880821
50441,STANFORD HEALTH CARE,300 PASTEUR DRIVE,STANFORD,CA,94305,SANTA CLARA,6507235708
50454,UCSF MEDICAL CENTER,"505 PARNASSUS AVE, BOX 0296",SAN FRANCISCO,CA,94143,SAN FRANCISCO,4153532733
50488,EDEN MEDICAL CENTER,20103 LAKE CHABOT ROAD,CASTRO VALLEY,CA,94546,ALAMEDA,5105371234
50567,MISSION HOSPITAL REGIONAL MED CENTER,27700 MEDICAL CENTER RD,MISSION VIEJO,CA,92691,ORANGE,9493641400
50684,MENIFEE VALLEY MEDICAL CENTER,28400 MCCALL B0ULEVARD,SUN CITY,CA,92585,RIVERSIDE,9516798888
50717,LAC/RANCHO LOS AMIGOS NATIONAL REHABILITATION  CTR,7601 EAST IMPERIAL HIGHWAY,DOWNEY,CA,90242,ORANGE,5624017022
51310,FRANK R HOWARD MEMORIAL HOSPITAL,1 MARCELA DR,WILLITS,CA,95490,MENDOCINO,7074563031
51317,ST HELENA HOSPITAL-CLEARLAKE,15630 18TH AVE - HWY 53,CLEARLAKE,CA,95422,LAKE,7079946486
60104,ST ANTHONY NORTH HEALTH CAMPUS,14300 ORCHARD PARKWAY,WESTMINSTER,CO,80023,BROOMFIELD,3034303201
70025,HARTFORD HOSPITAL,80 SEYMOUR STREET,HARTFORD,CT,6102,HARTFORD,8605455000
70029,BRISTOL HOSPITAL,BREWSTER RD,BRISTOL,CT,6010,HARTFORD,8605853000
80003,ST FRANCIS HOSPITAL,7TH AND CLAYTON STS,WILMINGTON,DE,19805,NEW CASTLE,3024214100
100054,TWIN CITIES HOSPITAL,2190 HWY 85 N,NICEVILLE,FL,32578,OKALOOSA,8506784131
100137,HEART OF FLORIDA REGIONAL MEDICAL CENTER,40100 US HWY 27 N,DAVENPORT,FL,33837,POLK,8634224971
100183,CORAL GABLES HOSPITAL,3100 DOUGLAS RD,CORAL GABLES,FL,33134,MIAMI-DADE,3054458461
100209,KENDALL REGIONAL MEDICAL CENTER,11750 BIRD RD,MIAMI,FL,33175,MIAMI-DADE,3052233000
100212,OCALA REGIONAL MEDICAL CENTER,1431 SW 1ST AVE,OCALA,FL,34478,MARION,3524011000
100289,CLEVELAND CLINIC HOSPITAL,3100 WESTON RD,WESTON,FL,33331,BROWARD,9546895000
110030,CARTERSVILLE MEDICAL CENTER,960 JOE FRANK HARRIS PARKWAY,CARTERSVILLE,GA,30120,BARTOW,7703878182
110038,JOHN D ARCHBOLD MEMORIAL HOSPITAL,915 GORDON AVENUE & MIMOSA DRIVE,THOMASVILLE,GA,31792,THOMAS,2292282880
110041,HABERSHAM COUNTY MEDICAL CTR,541 HISTORIC HIGHWAY 441-NORTH,DEMOREST,GA,30535,HABERSHAM,7067542161
110042,WELLSTAR PAULDING HOSPITAL,2518 JIMMY LEE SMITH PARKWAY,HIRAM,GA,30141,PAULDING,4706447000
110128,MEADOWS REGIONAL MEDICAL CENTER,ONE MEADOWS PARKWAY,VIDALIA,GA,30474,TOOMBS,9125355828
111313,PUTNAM GENERAL HOSPITAL,101 LAKE OCONEE PARKWAY,EATONTON,GA,31024,PUTNAM,7064852711
120028,NORTH HAWAII COMMUNITY HOSPITAL,67 1125 MAMALAHOA HIGHWAY,KAMUELA,HI,96743,HAWAII,8088854444
130013,SAINT ALPHONSUS MEDICAL CENTER - NAMPA,1512 TWELFTH AVENUE ROAD,NAMPA,ID,83686,CANYON,2084635000
140002,ALTON MEMORIAL HOSPITAL,ONE MEMORIAL DRIVE,ALTON,IL,62002,MADISON,6184637300
140007,PRESENCE SAINT JOSEPH MEDICAL CENTER,333 N MADISON,JOLIET,IL,60435,WILL,8157257133
140018,MT SINAI HOSPITAL MEDICAL CENTER,15TH STREET AT CALIFORNIA,CHICAGO,IL,60608,COOK,7732576751
140052,OSF SAINT ANTHONY'S HEALTH CENTER,ST ANTHONY'S WAY,ALTON,IL,62002,MADISON,6184652571
140118,METROSOUTH MEDICAL CENTER,12935 S GREGORY,BLUE ISLAND,IL,60406,COOK,7085972000
140191,INGALLS MEMORIAL HOSPITAL,ONE INGALLS DRIVE,HARVEY,IL,60426,COOK,7083332300
140210,HARRISBURG MEDICAL CENTER,100 DOCTOR WARREN TUTTLE DR,HARRISBURG,IL,62946,SALINE,6182537671
140258,ALEXIAN BROTHERS MEDICAL CENTER 1,800 W BIESTERFIELD RD,ELK GROVE VILLAGE,IL,60007,COOK,8474375500
140286,KISHWAUKEE COMMUNITY HOSPITAL,ONE KISH HOSPITAL DRIVE,DEKALB,IL,60115,DEKALB,8157561521
141349,SPARTA COMMUNITY HOSPITAL,818 E BROADWAY,SPARTA,IL,62286,RANDOLPH,6184432177
150026,IU HEALTH GOSHEN HOSPITAL,200 HIGH PARK AVE,GOSHEN,IN,46526,ELKHART,5743641000
150069,KING'S DAUGHTERS' HEALTH,1373 EAST SR 62,MADISON,IN,47250,JEFFERSON,8128010105
160089,OTTUMWA REGIONAL HEALTH CENTER,1001 E PENNSYLVANIA,OTTUMWA,IA,52501,WAPELLO,6416827511
160153,MERCY MEDICAL CENTER-SIOUX CITY,801 5TH ST,SIOUX CITY,IA,51101,WOODBURY,7122792010
280040,METHODIST HOSPITAL,8303 DODGE ST,OMAHA,NE,68114,DOUGLAS,4023544000
161377,MERCY MEDICAL CENTER-CENTERVILLE,ONE ST JOSEPH'S DRIVE,CENTERVILLE,IA,52544,APPANOOSE,6414374111
170203,PREMIER SURGICAL INSTITUTE,"1619 K HIGHWAY 66, PO BOX 127",GALENA,KS,66739,CHEROKEE,6207831732
171327,ELLSWORTH COUNTY MEDICAL CENTER,1604 AYLWARD AVENUE,ELLSWORTH,KS,67439,ELLSWORTH,7854723111
180010,SAINT JOSEPH HOSPITAL,ONE SAINT JOSEPH DRIVE,LEXINGTON,KY,40504,FAYETTE,8593131000
180056,METHODIST HOSPITAL,1305 N ELM ST,HENDERSON,KY,42420,HENDERSON,2708277700
180079,HARRISON MEMORIAL HOSPITAL,1210 KY HWY 36 E,CYNTHIANA,KY,41031,HARRISON,8592342300
180080,BAPTIST HEALTH CORBIN,ONE TRILLIUM WAY,CORBIN,KY,40701,KNOX,6065281212
180103,BAPTIST HEALTH LEXINGTON,1740 NICHOLASVILLE ROAD,LEXINGTON,KY,40503,FAYETTE,8592606104
190027,CHRISTUS ST PATRICK HOSPITAL,524 DR MICHAEL DEBAKEY STREET,LAKE CHARLES,LA,70601,CALCASIEU,3374362511
190144,MINDEN MEDICAL CENTER,NO 1 MEDICAL PLAZA,MINDEN,LA,71055,WEBSTER,3183772321
200018,AROOSTOOK MEDICAL CENTER,PO BOX 151,PRESQUE ISLE,ME,4769,AROOSTOOK,2077684000
200033,EASTERN MAINE MEDICAL CENTER,PO BOX 404,BANGOR,ME,4401,PENOBSCOT,2079737000
200034,ST MARYS REGIONAL MEDICAL CENTER,CAMPUS AVENUE - PO BOX 7291,LEWISTON,ME,4240,ANDROSCOGGIN,2077778100
220010,LAWRENCE GENERAL HOSPITAL,ONE GENERAL STREET,LAWRENCE,MA,1842,ESSEX,9786834000
220073,MORTON HOSPITAL,88 WASHINGTON STREET,TAUNTON,MA,2780,BRISTOL,5088287000
220084,EMERSON HOSPITAL,OLD ROAD TO 9 ACRE CORNER,W CONCORD,MA,1742,MIDDLESEX,9783691400
220171,"LAHEY HOSPITAL & MEDICAL CENTER, BURLINGTON",41 & 45 MALL ROAD,BURLINGTON,MA,1803,MIDDLESEX,7817445100
230108,UP HEALTH SYSTEM PORTAGE,500 CAMPUS DRIVE,HANCOCK,MI,49930,HOUGHTON,9064831000
230110,SPECTRUM HEALTH LUDINGTON HOSPITAL,ONE N ATKINSON DRIVE,LUDINGTON,MI,49431,MASON,2318432591
230132,HURLEY MEDICAL CENTER,ONE HURLEY PLAZA,FLINT,MI,48503,GENESEE,8102579000
230156,ST JOSEPH MERCY HOSPITAL,5301 E HURON RIVER DR,ANN ARBOR,MI,48106,WASHTENAW,7347123456
230176,BEAUMONT HOSPITAL - TRENTON,5450 FORT STREET,TRENTON,MI,48183,WAYNE,7346713800
230197,GENESYS REGIONAL MEDICAL CENTER - HEALTH PARK,ONE GENESYS PARKWAY,GRAND BLANC,MI,48439,GENESEE,8106065000
230269,"BEAUMONT HOSPITAL, TROY",44201 DEQUINDRE ROAD,TROY,MI,48085,OAKLAND,2489648800
230273,DETROIT RECEIVING HOSPITAL & UNIV HEALTH CENTER,4201 ST ANTOINE ST - 3M,DETROIT,MI,48201,WAYNE,3137453104
230277,HURON VALLEY-SINAI HOSPITAL,ONE WILLIAM CARLS DRIVE,COMMERCE TOWNSHIP,MI,48382,OAKLAND,2489373370
231323,SPECTRUM HEALTH REED CITY HOSPITAL,"300 N PATTERSON, PO BOX 75",REED CITY,MI,49677,OSCEOLA,2318323271
250004,NORTH MISSISSIPPI MEDICAL CENTER,830 S GLOSTER,TUPELO,MS,38801,LEE,6623773000
250006,BAPTIST MEMORIAL HOSPITAL UNION COUNTY,200 HWY 30 WEST,NEW ALBANY,MS,38652,UNION,6625387631
250057,KING'S DAUGHTERS MEDICAL CENTER-BROOKHAVEN,P O BOX 948/427 HIGHWAY 51 NORTH,BROOKHAVEN,MS,39601,LINCOLN,6018336011
250084,MERIT HEALTH NATCHEZ,52 SERGEANT PRENTISS DRIVE,NATCHEZ,MS,39120,ADAMS,6014432100
260020,MERCY HOSPITAL ST LOUIS,615 NEW BALLAS ROAD,SAINT LOUIS,MO,63141,SAINT LOUIS,3145696000
260032,BARNES JEWISH HOSPITAL,ONE BARNES-JEWISH HOSPITAL PLAZA,SAINT LOUIS,MO,63110,SAINT LOUIS CITY,3147473000
260141,UNIVERSITY OF MISSOURI HEALTH CARE,ONE HOSPITAL DRIVE,COLUMBIA,MO,65212,BOONE,5738824141
260183,SAINT FRANCIS MEDICAL CENTER,211 ST FRANCIS DR,CAPE GIRARDEAU,MO,63703,CAPE GIRARDEAU,5733313000
270003,ST PETER'S HOSPITAL,2475 BROADWAY,HELENA,MT,59601,LEWIS AND CLARK,4064422480
280009,CHI HEALTH GOOD SAMARITAN,"P O BOX 1990, 10 EAST 31ST ST",KEARNEY,NE,68848,BUFFALO,3088657100
280013,THE NEBRASKA MEDICAL CENTER DBA NEBRASKA MEDICINE,987400 NEBRASKA MEDICAL CENTER,OMAHA,NE,68198,DOUGLAS,4025522040
290045,ST ROSE DOMINICAN HOSPITALS - SIENA CAMPUS,3001 ST ROSE PARKWAY,HENDERSON,NV,89052,CLARK,7026165000
300012,ELLIOT HOSPITAL,1 ELLIOT WAY,MANCHESTER,NH,3103,HILLSBOROUGH,6036695300
310009,CLARA MAASS MEDICAL CENTER,ONE CLARA MAAS DRIVE,BELLEVILLE,NJ,7109,ESSEX,9734502002
310010,UNIV MEDICAL CENTER OF PRINCETON AT PLAINSBORO,ONE-FIVE PLAINSBORO ROAD,PLAINSBORO,NJ,8536,MIDDLESEX,8664604776
310011,CAPE REGIONAL MEDICAL CENTER INC,TWO STONE HARBOR BLVD,CAPE MAY COURT HOUSE,NJ,8210,CAPE MAY,6094632000
310034,RIVERVIEW MEDICAL CENTER,ONE RIVERVIEW PLAZA,RED BANK,NJ,7701,MONMOUTH,7327412700
310038,ROBERT WOOD JOHNSON UNIVERSITY HOSPITAL,ONE ROBERT WOOD JOHNSON PLACE,NEW BRUNSWICK,NJ,8901,MIDDLESEX,7329378900
310044,CAPITAL HEALTH MEDICAL CENTER - HOPEWELL,ONE CAPITAL WAY,PENNINGTON,NJ,8534,MERCER,6093034000
310054,HACKENSACK-UMC MOUNTAINSIDE,BAY AND HIGHLAND AVE,MONTCLAIR,NJ,7042,ESSEX,9734296000
310110,ROBERT WOOD JOHNSON UNIVERSITY HOSPITAL HAMILTON,ONE HAMILTON HEALTH PLACE,HAMILTON,NJ,8690,MERCER,6095867900
310113,SOUTHERN OCEAN MEDICAL CENTER,1140 RT 72 W,MANAHAWKIN,NJ,8050,OCEAN,6095976011
320059,NORTHERN NAVAJO MEDICAL CENTER,US HWY 491 NORTH,SHIPROCK,NM,87420,SAN JUAN,5053686001
321309,MIMBRES MEMORIAL HOSPITAL,900 W ASH,DEMING,NM,88031,LUNA,5755465803
330024,MOUNT SINAI HOSPITAL,ONE GUSTAVE L LEVY PLACE,NEW YORK,NY,10029,NEW YORK,2122417981
330044,FAXTON-ST LUKE'S HEALTHCARE,1656 CHAMPLIN AVENUE,UTICA,NY,13503,ONEIDA,3157986000
330085,AURELIA OSBORN FOX MEMORIAL HOSPITAL,ONE NORTON AVENUE,ONEONTA,NY,13820,OTSEGO,6074232000
330136,MARY IMOGENE BASSETT HOSPITAL,ONE ATWELL ROAD,COOPERSTOWN,NY,13326,OTSEGO,6075473456
330181,GLEN COVE HOSPITAL,101 ST ANDREWS LANE,GLEN COVE,NY,11542,NASSAU,5166747300
330195,LONG ISLAND JEWISH MEDICAL CENTER,270 - 05 76TH AVENUE,NEW HYDE PARK,NY,11040,QUEENS,7184707000
330198,SOUTH NASSAU COMMUNITIES HOSPITAL,ONE HEALTHY WAY,OCEANSIDE,NY,11572,NASSAU,5166323000
330231,QUEENS HOSPITAL CENTER,82-68 164TH STREET,JAMAICA,NY,11432,QUEENS,7188833000
330385,NORTH CENTRAL BRONX HOSPITAL,3424 KOSSUTH AVENUE & 210TH STREET,BRONX,NY,10467,BRONX,2125195000
330386,CATSKILL REGIONAL MEDICAL CENTER,68 HARRIS BUSHVILLE ROAD,HARRIS,NY,12742,SULLIVAN,8457943300
330393,UNIVERSITY HOSPITAL ( STONY BROOK ),HEALTH SCIENCES CENTER SUNY,STONY BROOK,NY,11794,SUFFOLK,6314444000
340030,DUKE UNIVERSITY HOSPITAL,PO BOX 3814 DUMC  ERWIN RD,DURHAM,NC,27710,DURHAM,9196848111
340047,NORTH CAROLINA BAPTIST HOSPITAL,MEDICAL CENTER BOULEVARD,WINSTON-SALEM,NC,27157,FORSYTH,3367162011
340132,MARIA PARHAM MEDICAL CENTER,PO BOX 59,HENDERSON,NC,27536,VANCE,2524313708
340127,GRANVILLE HEALTH SYSTEMS,COLLEGE ST BOX 947,OXFORD,NC,27565,GRANVILLE,9196903000
340143,CATAWBA VALLEY MEDICAL CENTER,810 FAIRGROVE CHURCH RD,HICKORY,NC,28602,CATAWBA,8283263809
340144,DAVIS REGIONAL MEDICAL CENTER,218 OLD MOCKSBVILLE RD PO BOX 1823,STATESVILLE,NC,28687,IREDELL,7048730281
340171,PRESBYTERIAN HOSPITAL MATTHEWS,1500 MATTHEWS TWNSHP PRKWY BOX 3310,MATTHEWS,NC,28106,MECKLENBURG,7043846500
350063,P H S INDIAN HOSP AT BELCOURT-QUENTIN N BURDICK,PO BOX 160,BELCOURT,ND,58316,ROLETTE,7014776111
360051,MIAMI VALLEY HOSPITAL,ONE WYOMING STREET,DAYTON,OH,45409,MONTGOMERY,9372088000
360076,ATRIUM MEDICAL CENTER,ONE MEDICAL CENTER DRIVE,FRANKLIN,OH,45005,WARREN,5134205102
370034,MCALESTER REGIONAL HEALTH CENTER AUTHORITY,ONE CLARK BASS BOULEVARD,MCALESTER,OK,74501,PITTSBURG,9184261800
370048,MCCURTAIN MEMORIAL HOSPITAL,1301 LINCOLN ROAD,IDABEL,OK,74745,MCCURTAIN,5802867623
370049,STILLWATER MEDICAL CENTER,1323 WEST 6TH STREET,STILLWATER,OK,74076,PAYNE,4053721480
370054,GRADY MEMORIAL HOSPITAL,2220 IOWA STREET,CHICKASHA,OK,73018,GRADY,4052242300
370183,HILLCREST HOSPITAL HENRYETTA,2401 W MAIN DEWEY BARTLETT AND MAIN,HENRYETTA,OK,74437,OKMULGEE,9186501511
370214,LINDSAY MUNICIPAL HOSPITAL,1305 W CHEROKEE STREET - HIGHWAY 19 WEST,LINDSAY,OK,73052,GARVIN,4057561404
371326,ALLIANCEHEALTH MADILL,ONE HOSPITAL DRIVE,MADILL,OK,73446,MARSHALL,5807953384
381319,ST ANTHONY HOSPITAL,2801 ST ANTHONY WAY,PENDLETON,OR,97801,UMATILLA,5412765121
390013,EVANGELICAL COMMUNITY HOSPITAL,ONE HOSPITAL DRIVE,LEWISBURG,PA,17837,UNION,5705222200
390025,KENSINGTON HOSPITAL,136 W DIAMOND STREET,PHILADELPHIA,PA,19122,PHILADELPHIA,2154268100
390066,GOOD SAMARITAN HOSPITAL,FOURTH AND WALNUT STREETS,LEBANON,PA,17042,LEBANON,7172707500
390079,ROBERT PACKER HOSPITAL,ONE GUTHRIE SQUARE,SAYRE,PA,18840,BRADFORD,5708886666
390093,CLARION HOSPITAL,ONE HOSPITAL DRIVE,CLARION,PA,16214,CLARION,8142269500
390111,HOSPITAL OF UNIV OF PENNSYLVANIA,34TH & SPRUCE STS,PHILADELPHIA,PA,19104,PHILADELPHIA,2156623227
390123,POTTSTOWN MEMORIAL MEDICAL CENTER,1600 EAST HIGH STREET AND ARMAND HAMMER BLVD,POTTSTOWN,PA,19464,MONTGOMERY,6103277000
390146,WARREN GENERAL HOSPITAL,TWO CRESCENT PARK WEST,WARREN,PA,16365,WARREN,8147233300
390156,MERCY FITZGERALD HOSPITAL,LANSDOWNE & BAILY RDS,DARBY,PA,19023,DELAWARE,2152374000
390163,ACMH HOSPITAL,ONE NOLTE DRIVE,KITTANNING,PA,16201,ARMSTRONG,7245438500
390168,BUTLER MEMORIAL HOSPITAL,ONE HOSPITAL WAY,BUTLER,PA,16001,BUTLER,7242836666
390180,CROZER CHESTER MEDICAL CENTER,ONE MEDICAL CENTER BOULEVARD,UPLAND,PA,19013,DELAWARE,6104472000
390195,MAIN LINE HOSPITAL LANKENAU,100 LANCASTER AVE,WYNNEWOOD,PA,19096,MONTGOMERY,6106452000
390219,EXCELA HEALTH LATROBE HOSPITAL,ONE MELLON WAY,LATROBE,PA,15650,WESTMORELAND,7245371000
390258,ST MARY MEDICAL CENTER,LANGHORNE-NEWTOWN RD,LANGHORNE,PA,19047,BUCKS,2157502003
390265,JEFFERSON REGIONAL MEDICAL CENTER,565 COAL VALLEY RD,PITTSBURGH,PA,15236,ALLEGHENY,4124695000
400022,HOSPITAL DAMAS INC,PONCE BY PASS #2213,PONCE,PR,717,PONCE,7878408460
400001,PRESBYTERIAN COMMUNITY HOSP,1451 ASHFORD AVENUE,SAN JUAN,PR,907,SAN JUAN,7877212160
400004,"ASOCIACION HOSPITAL DEL MAESTRO, INC",SERGIO CUEVAS BUSTAMANTE STREET 550,SAN JUAN,PR,936,SAN JUAN,7877586420
400007,RYDER MEMORIAL HOSPITAL INC,355 AVE FONT MARTELO,HUMACAO,PR,791,HUMACAO,7878520768
400016,AUXILIO MUTUO HOSPITAL,PONCE DE LEON AVENUE STOP 36 1/2 #735,HATO REY,PR,918,SAN JUAN,7877582000
400013,HOSPITAL MENONITA DE CAYEY,BO. RINCON SECTOR LAS LOMAS  KM.3.1 CARR 14,CAYEY,PR,737,CAYEY,7875351001
400019,HOSPITAL PAVIA SANTURCE,CALLE PROFESOR AUGUSTO RODRIGUEZ #1462,FERNANDEZ JUNCOS,PR,910,SAN JUAN,7877276060
400021,HOSPITAL DE LA CONCEPCION,ROAD NUMBER 2 KM 173.4 CAIN ALTO,SAN GERMAN,PR,683,SAN GERMAN,7878921860
400044,SAN LUKE'S MEMORIAL HOSPITAL INC,TITO CASTRO AVE #917,PONCE,PR,733,PONCE,7878442080
400098,HOSPITAL SAN FRANCISCO,371 DE DIEGO AVE,SAN JUAN,PR,923,SAN JUAN,7877675100
400109,HIMA SAN PABLO BAYAMON,CALLE SANTA CRUZ NUMERO 70  URB SANTA CRUZ,BAYAMON,PR,961,BAYAMON,7876204747
400114,MANATI MEDICAL CENTER DR OTERO LOPEZ,CALLE HERNANDEZ CARRION URB ATENAS,MANATI,PR,674,MANATI,7876213700
400124,CENTRO CARDIOVASCULAR,"AVENIDA AMERICO MIRANDA, ENTRADA PRINCIPAL CM",RIO PIEDRAS,PR,936,SAN JUAN,7877548500
410006,NEWPORT HOSPITAL,FRIENDSHIP STREET,NEWPORT,RI,2840,NEWPORT,4018466400
420011,CANNON MEMORIAL HOSPITAL,123 MEDICAL PARK DRIVE PO BOX 188,PICKENS,SC,29671,PICKENS,8648784791
420015,BAPTIST EASLEY HOSPITAL,PO BOX 2129,EASLEY,SC,29641,PICKENS,8644427200
420023,ST FRANCIS-DOWNTOWN,ONE ST FRANCIS DR,GREENVILLE,SC,29601,GREENVILLE,8008055678
420048,KERSHAW HEALTH,"HAILE AND ROBERTS STREETS, BOX 7003",CAMDEN,SC,29020,KERSHAW,8034324311
420068,TRMC OF ORANGEBURG & CALHOUN,3000 ST MATTHEWS RD BOX 1806,ORANGEBURG,SC,29115,ORANGEBURG,8035332460
420069,CLARENDON MEMORIAL HOSPITAL,10 HOSPITAL ST BOX 550,MANNING,SC,29102,CLARENDON,8034353386
420086,PALMETTO HEALTH BAPTIST,TAYLOR AT MARION ST,COLUMBIA,SC,29220,RICHLAND,8032965678
420098,WACCAMAW COMMUNITY HOSPITAL,4070 HIGHWAY 17 BYPASS,MURRELLS INLET,SC,29576,GEORGETOWN,8436521000
420106,PALMETTO HEALTH BAPTIST PARKRIDGE,400 PALMETTO HEALTH PARKWAY,COLUMBIA,SC,29212,LEXINGTON,8039077011
430081,PHS INDIAN HOSPITAL AT PINE RIDGE,"HIGHWAY 18, MAIN ST., BLDG. 159",PINE RIDGE,SD,57770,,6058675131
440001,UNICOI COUNTY MEMORIAL HOSPITAL,GREENWAY CIRCLE,ERWIN,TN,37650,UNICOI,4237433141
440012,WELLMONT BRISTOL REGIONAL MEDICAL CENTER,ONE MEDICAL PARK BLVD,BRISTOL,TN,37620,SULLIVAN,4238441121
440082,SAINT THOMAS WEST HOSPITAL,"4220 HARDING RD, PO BOX 380",NASHVILLE,TN,37205,DAVIDSON,6152222111
440175,SOUTHERN TENNESSEE REGIONAL HEALTH SYSTEM LAWRENCE,HWY 43 S BOX 847,LAWRENCEBURG,TN,38464,LAWRENCE,9317626571
450044,UT SOUTHWESTERN UNIVERSITY HOSPITAL ST PAUL,6201 HARRY HINES BLVD,DALLAS,TX,75390,DALLAS,2146335555
450099,PAMPA REGIONAL MEDICAL CENTER,1 MEDICAL PLAZA,PAMPA,TX,79065,GRAY,8066653721
450165,SOUTH TEXAS REGIONAL MEDICAL CENTER,1905 HWY 97 EAST,JOURDANTON,TX,78026,ATASCOSA,8307693515
450210,ETMC CARTHAGE,409 WEST COTTAGE,CARTHAGE,TX,75633,PANOLA,936933841
450214,GULF COAST MEDICAL CENTER,10141 US 59 NORTH,WHARTON,TX,77488,WHARTON,9795322500
450237,CHRISTUS SANTA ROSA HOSPITAL,333 NORTH SANTA ROSA STEET,SAN ANTONIO,TX,78207,BEXAR,2107043342
450324,TEXOMA MEDICAL CENTER,5016 S US HIGHWAY 75,DENISON,TX,75020,GRAYSON,9034164000
450352,HUNT REGIONAL MEDICAL CENTER,4215 JOE RAMSEY BLVD,GREENVILLE,TX,75401,HUNT,9034085000
450395,MEMORIAL MEDICAL CENTER LIVINGSTON,1717 HWY 59 BYPASS,LIVINGSTON,TX,77351,POLK,9363274381
450662,VALLEY REGIONAL MEDICAL CENTER,100 A ALTON GLOOR,BROWNSVILLE,TX,78526,CAMERON,9563507000
450674,"WOMANS HOSPITAL OF TEXAS,THE",7600 FANNIN,HOUSTON,TX,77054,HARRIS,7137901234
450766,UT SOUTHWESTERN UNIVERSITY HOSPITAL-ZALE LIPSHY,5151 HARRY HINES BLVD,DALLAS,TX,75390,DALLAS,2148793758
451365,SETON HIGHLAND LAKES,HIGHWAY 281 SOUTH,BURNET,TX,78611,BURNET,5127153000
460006,LDS HOSPITAL,8TH AVENUE AND C STREET,SALT LAKE CITY,UT,84143,SALT LAKE,8014081100
460010,INTERMOUNTAIN MEDICAL CENTER,5121 SOUTH COTTONWOOD STREET,MURRAY,UT,84107,SALT LAKE,8015077000
460049,THE ORTHOPEDIC SPECIALTY HOSPITAL,5848 SOUTH 300 EAST,MURRAY,UT,84107,SALT LAKE,8013144100
470001,CENTRAL VERMONT MEDICAL CENTER,BOX 547,BARRE,VT,5641,WASHINGTON,8023714100
471300,GRACE COTTAGE HOSPITAL,PO BOX 216,TOWNSHEND,VT,5353,WINDHAM,8023657920
471306,SPRINGFIELD HOSPITAL,PO BOX 2003,SPRINGFIELD,VT,5156,WINDSOR,8028852151
490009,UNIVERSITY OF VIRGINIA MEDICAL CENTER,JEFFERSON PARK AVE,CHARLOTTESVILLE,VA,22908,CHARLOTTESVILLE CITY,8002513627
490013,SENTARA HALIFAX REGIONAL HOSPITAL,2204 WILBORN AVENUE,HALIFAX,VA,24558,HALIFAX,4345173100
480001,"ROY LESTER SCHNEIDER HOSPITAL,THE",9048 SUGAR ESTATE,ST THOMAS,VI,801,,8097768311
480002,GOV JUAN F LUIS HOSPITAL & MEDICAL CTR,"#4007 EST DIAMOND RUBY, CHRISTIANSTED",ST CROIX,VI,820,,3407786311
490037,RIVERSIDE SHORE MEMORIAL HOSPITAL,9507 HOSPITAL AVENUE,NASSAWADOX,VA,23413,NORTHAMPTON,7574148000
490060,CLINCH VALLEY MEDICAL CENTER,2949 WEST FRONT STREET,RICHLANDS,VA,24641,TAZEWELL,2765966000
490126,LEWISGALE HOSPITAL ALLEGHANY,ONE ARH LANE - PO BOX 7,LOW MOOR,VA,24457,ALLEGHANY,5408626011
500044,DEACONESS HOSPITAL,W 800 FIFTH AVENUE,SPOKANE,WA,99210,SPOKANE,5094735800
500129,TACOMA GENERAL ALLENMORE HOSPITAL,315 S MLK JR WAY,TACOMA,WA,98415,PIERCE,2534031000
501320,QUINCY VALLEY HOSPITAL,908 10TH AVENUE SOUTHWEST,QUINCY,WA,98848,GRANT,5097873531
390133,LEHIGH VALLEY HOSPITAL,1200 SOUTH CEDAR CREST BOULVARD,ALLENTOWN,PA,18105,LEHIGH,6104022273
510030,DAVIS MEDICAL CENTER,PO BOX 1484,ELKINS,WV,26241,RANDOLPH,3046363300
510001,WEST VIRGINIA UNIVERSITY HOSPITALS,MEDICAL CENTER DRIVE,MORGANTOWN,WV,26506,MONONGALIA,3045984000
510002,GREENBRIER VALLEY MEDICAL CENTER,1320 MAPLEWOOD AVENUE  PO BOX 497,RONCEVERTE,WV,24970,GREENBRIER,3046474411
511312,PRESTON MEMORIAL HOSPITAL,150 MEMORIAL DRIVE,KINGWOOD,WV,26537,PRESTON,3043291400
520037,MINISTRY SAINT JOSEPHS HOSPITAL,611 ST JOSEPH AVE,MARSHFIELD,WI,54449,WOOD,7153877850
520103,COMMUNITY MEMORIAL HOSPITAL,W180 N8085 TOWN HALL RD,MENOMONEE FALLS,WI,53051,WAUKESHA,2622511000
520207,AURORA MEDICAL CENTER,975 PORT WASHINGTON ROAD,GRAFTON,WI,53024,OZAUKEE,2623291000
531316,MEMORIAL HOSPITAL OF CARBON COUNTY,2221 WEST ELM STREET,RAWLINS,WY,82301,CARBON,3073242221
670004,ST MARKS MEDICAL CENTER,ONE ST MARK'S PLACE,LA GRANGE,TX,78945,FAYETTE,9792422200
650001,GUAM MEMORIAL HOSPITAL AUTHORITY,85O GOV CARLOS G CAMACHO ROAD,TAMUNING,GU,96913,,6716472552
10100,THOMAS HOSPITAL,750 MORPHY AVENUE,FAIRHOPE,AL,36532,BALDWIN,2519282375
670088,BAYLOR SCOTT & WHITE MEDICAL CENTER- COLLEGE STATI,700 SCOTT & WHITE DRIVE,COLLEGE STATION,TX,77845,BRAZOS,9796913701
250040,SINGING RIVER HOSPITAL,2809 DENNY AV,PASCAGOULA,MS,39581,JACKSON,2288095000
330049,NORTHERN DUTCHESS HOSPITAL,6511 SPRINGBROOK AVENUE,RHINEBECK,NY,12572,DUTCHESS,8458713391
110008,NORTHSIDE HOSPITAL CHEROKEE,201 HOSPITAL ROAD,CANTON,GA,30114,CHEROKEE,7707205100
110005,NORTHSIDE HOSPITAL FORSYTH,1200 NORTHSIDE FORSYTH DRIVE,CUMMING,GA,30041,FORSYTH,7708443200
450011,ST JOSEPH REGIONAL HEALTH CENTER,2801 FRANCISCAN DR,BRYAN,TX,77802,BRAZOS,9797763912
390063,UPMC HAMOT,201 STATE STREET,ERIE,PA,16550,ERIE,8148776000
100052,WINTER HAVEN HOSPITAL,200 AVE F NE,WINTER HAVEN,FL,33881,POLK,8632931121
440193,UNIVERSITY MEDICAL CENTER,1411 BADDOUR PARKWAY,LEBANON,TN,37087,WILSON,6154448262
10092,D C H REGIONAL MEDICAL CENTER,809 UNIVERSITY BOULEVARD EAST,TUSCALOOSA,AL,35401,TUSCALOOSA,2057597111
360070,MERCY MEDICAL CENTER,1320 MERCY DRIVE NW,CANTON,OH,44708,STARK,3304891001
460044,ALTA VIEW HOSPITAL,9660 SOUTH 1300 EAST,SANDY,UT,84094,SALT LAKE,8015012600
30069,HAVASU REGIONAL MEDICAL CENTER,101 CIVIC CENTER LANE,LAKE HAVASU CITY,AZ,86403,MOHAVE,9288558185
150048,REID HEALTH,1100 REID PKWY,RICHMOND,IN,47374,WAYNE,7659833000
260113,MISSOURI DELTA MEDICAL CENTER,1008 NORTH MAIN ST,SIKESTON,MO,63801,NEW MADRID,5734711600
490023,FAUQUIER HOSPITAL,500 HOSPITAL DRIVE,WARRENTON,VA,20186,FAUQUIER,5403165000
330104,NYACK HOSPITAL,160 NORTH MIDLAND AVENUE,NYACK,NY,10960,ROCKLAND,8453482000
140119,RUSH UNIVERSITY MEDICAL CENTER,1653 WEST CONGRESS PARKWAY,CHICAGO,IL,60612,COOK,3129425000
140181,SOUTH SHORE HOSPITAL,8012 SOUTH CRANDON AVENUE,CHICAGO,IL,60617,COOK,7737680810
330023,VASSAR BROTHERS MEDICAL CENTER,45 READE PLACE,POUGHKEEPSIE,NY,12601,DUTCHESS,8454548500
100071,BAYFRONT HEALTH BROOKSVILLE,17240 CORTEZ BLVD,BROOKSVILLE,FL,34601,HERNANDO,3527965111
450885,CENTENNIAL MEDICAL CENTER,12505 LEBANON ROAD,FRISCO,TX,75035,COLLIN,9729633333
300014,FRISBIE MEMORIAL HOSPITAL,11 WHITEHALL ROAD,ROCHESTER,NH,3867,STRAFFORD,6033325211
220011,CAMBRIDGE HEALTH ALLIANCE,1493 CAMBRIDGE STREET,CAMBRIDGE,MA,2138,MIDDLESEX,6176652300
50089,COMMUNITY HOSPITAL OF SAN BERNARDINO,1805 MEDICAL CENTER DRIVE,SAN BERNARDINO,CA,92411,SAN BERNARDINO,9098876333
140113,PRESENCE COVENANT MEDICAL CENTER,1400 WEST PARK AVENUE,URBANA,IL,61801,CHAMPAIGN,2173372000
20017,ALASKA REGIONAL HOSPITAL,2801 DEBARR ROAD,ANCHORAGE,AK,99508,ANCHORAGE,9072761131
450347,HUNTSVILLE MEMORIAL HOSPITAL,110 MEMORIAL HOSPITAL DRIVE,HUNTSVILLE,TX,77340,WALKER,9362913411
150002,METHODIST HOSPITALS INC,600 GRANT ST,GARY,IN,46402,LAKE,2198864642
420078,GHS GREENVILLE MEMORIAL HOSPITAL,701 GROVE RD,GREENVILLE,SC,29605,GREENVILLE,8644557000
340010,WAYNE MEMORIAL HOSPITAL,2700 WAYNE MEMORIAL DR,GOLDSBORO,NC,27534,WAYNE,9197361110
300003,MARY HITCHCOCK MEMORIAL HOSPITAL,1 MEDICAL CENTER DRIVE,LEBANON,NH,3756,GRAFTON,6036505000
210016,ADVENTIST HEALTHCARE WASHINGTON ADVENTIST HOSPITAL,7600 CARROLL AVENUE,TAKOMA PARK,MD,20912,MONTGOMERY,3018915651
420007,SPARTANBURG MEDICAL CENTER,101 E WOOD ST,SPARTANBURG,SC,29303,SPARTANBURG,8645606000
110026,ELBERT MEMORIAL HOSPITAL,4 MEDICAL DRIVE,ELBERTON,GA,30635,ELBERT,7062132535
440016,BAPTIST MEMORIAL HOSPITAL HUNTINGDON,631 RB WILSON DR,HUNTINGDON,TN,38344,CARROLL,7319864461
360011,MARION GENERAL HOSPITAL,1000 MCKINLEY PARK DRIVE,MARION,OH,43302,MARION,7403838400
110011,TANNER MEDICAL CENTER - CARROLLTON,705 DIXIE STREET,CARROLLTON,GA,30117,CARROLL,7708369580
260091,SSM ST MARYS HEALTH CENTER,6420 CLAYTON RD,RICHMOND HEIGHTS,MO,63117,SAINT LOUIS,3147688000
120006,CASTLE MEDICAL CENTER,640 ULUKAHIKI ST,KAILUA,HI,96734,HONOLULU,8082635500
150090,FRANCISCAN ST MARGARET HEALTH - DYER,24 JOLIET ST,DYER,IN,46311,LAKE,2198652141
290019,CARSON TAHOE REGIONAL MEDICAL CENTER,1600 MEDICAL PARKWAY,CARSON CITY,NV,89703,CARSON CITY,7754458000
50523,SUTTER DELTA MEDICAL CENTER,3901 LONE TREE WAY,ANTIOCH,CA,94509,CONTRA COSTA,9257797200
410007,RHODE ISLAND HOSPITAL,593 EDDY STREET,PROVIDENCE,RI,2903,PROVIDENCE,4014444000
140281,NORTHWESTERN MEMORIAL HOSPITAL,251 E HURON ST,CHICAGO,IL,60611,COOK,3129262000
50039,ENLOE MEDICAL CENTER,1531 ESPLANADE,CHICO,CA,95926,BUTTE,5303327300
220033,BEVERLY HOSPITAL CORPORATION,85 HERRICK STREET,BEVERLY,MA,1915,ESSEX,9789223000
130003,ST JOSEPH REGIONAL MEDICAL CENTER,415 SIXTH STREET,LEWISTON,ID,83501,NEZ PERCE,2087995300
